{
  "$schema":"https://json-schema.org/draft/2020-12/schema","type":"object","additionalProperties":false,
  "required":["schema_version","status","purpose","registry_policy","sources","planned_studies","controls"],
  "properties":{
    "schema_version":{"const":"registry-source-expansion-catalog-v1"},"status":{"const":"governance_metadata_only_no_payload_or_empirical_authority"},"purpose":{"type":"string","minLength":1},
    "registry_policy":{"type":"object","additionalProperties":false,"required":["discovery_registries","lineage_rule","bioportal_mapping_methods","payload_permission_rule"],"properties":{"discovery_registries":{"type":"array","minItems":7,"maxItems":7,"items":{"type":"object","additionalProperties":false,"required":["registry_id","role","url"],"properties":{"registry_id":{"type":"string"},"role":{"type":"string"},"url":{"type":"string","pattern":"^https://"}}}},"lineage_rule":{"type":"string"},"bioportal_mapping_methods":{"type":"array","minItems":4,"uniqueItems":true,"items":{"type":"string"}},"payload_permission_rule":{"type":"string"}}},
    "sources":{"type":"array","minItems":21,"maxItems":21,"items":{"$ref":"#/$defs/source"}},
    "planned_studies":{"type":"array","minItems":6,"maxItems":6,"items":{"type":"object","additionalProperties":false,"required":["study_id","name","sources","claim_boundary"],"properties":{"study_id":{"pattern":"^R[1-6]$"},"name":{"type":"string"},"sources":{"type":"array","minItems":2,"uniqueItems":true,"items":{"type":"string"}},"claim_boundary":{"type":"string"}}}},
    "controls":{"type":"object","additionalProperties":false,"required":["payload_retrieval_authorized","translation_rows_added","empirical_execution_authorized","remote_upload_authorized","github_mutation_authorized","upstream_mutation_authorized","automatic_promotion_allowed","new_freeze_required"],"properties":{"payload_retrieval_authorized":{"const":false},"translation_rows_added":{"const":false},"empirical_execution_authorized":{"const":false},"remote_upload_authorized":{"const":false},"github_mutation_authorized":{"const":false},"upstream_mutation_authorized":{"const":false},"automatic_promotion_allowed":{"const":false},"new_freeze_required":{"const":true}}}
  },
  "$defs":{"source":{"type":"object","additionalProperties":false,"required":["source_id","name","priority","source_kind","release","authority_url","artifact_url","licence","languages","lineage_group","evidence_roles","mapping_boundary","archive_status","empirical_status","direct_lexical_vote"],"properties":{"source_id":{"pattern":"^[a-z0-9-]+$"},"name":{"type":"string","minLength":1},"priority":{"enum":["P1","P2","P3","historical","deferred"]},"source_kind":{"type":"string"},"release":{"type":"string"},"authority_url":{"type":"string","pattern":"^https://"},"artifact_url":{"type":"string"},"licence":{"type":"string"},"languages":{"type":"array","uniqueItems":true,"items":{"type":"string"}},"language_neutral":{"type":"boolean"},"lineage_group":{"type":"string"},"evidence_roles":{"type":"array","minItems":1,"uniqueItems":true,"items":{"type":"string"}},"mapping_boundary":{"type":"string"},"archive_status":{"type":"string"},"empirical_status":{"type":"string"},"direct_lexical_vote":{"const":false}}}}
}
