{
  "schema_version": "registry-source-expansion-catalog-v1",
  "status": "governance_metadata_only_no_payload_or_empirical_authority",
  "purpose": "Resolve registry-discovered biomedical resources to authoritative upstream releases, licences, evidence roles, lineages and fail-closed dispositions for the evidence-confidence platform.",
  "registry_policy": {
    "discovery_registries": [
      {"registry_id":"obo-foundry","role":"curated_authority_and_metadata_pointer","url":"https://obofoundry.org/"},
      {"registry_id":"ols4","role":"discovery_api_release_monitoring","url":"https://www.ebi.ac.uk/ols4/"},
      {"registry_id":"ontobee","role":"obo_term_dereferencing_query_fallback","url":"https://ontobee.org/"},
      {"registry_id":"bioportal","role":"broad_discovery_and_mapping_method_inventory","url":"https://bioportal.bioontology.org/ontologies"},
      {"registry_id":"fairsharing","role":"dataset_and_standard_discovery_metadata","url":"https://fairsharing.org/"},
      {"registry_id":"lov","role":"provenance_and_semantic_web_vocabulary_discovery","url":"https://lov.linkeddata.es/dataset/lov/"},
      {"registry_id":"umich-guide","role":"human_discovery_guide_only","url":"https://guides.lib.umich.edu/ontology/ontologies"}
    ],
    "lineage_rule": "Registry presence, mirrors, dereferencing endpoints and catalogue mappings never create independent evidence; every admitted record resolves to the authoritative upstream artifact and originating mapping method.",
    "bioportal_mapping_methods": ["LOOM lexical mapping", "UMLS CUI", "MRMAP", "upstream OBO xref"],
    "payload_permission_rule": "Registry availability never proves payload licence, reuse, storage, translation, adaptation or redistribution permission."
  },
  "sources": [
    {"source_id":"maxo","name":"Medical Action Ontology","priority":"P1","source_kind":"ontology","release":"2026-01-15","authority_url":"https://obofoundry.org/ontology/maxo.html","artifact_url":"http://purl.obolibrary.org/obo/maxo/releases/2026-01-15/maxo.owl","licence":"CC-BY-4.0","languages":["en"],"lineage_group":"maxo-hpo-treatment","evidence_roles":["treatment_context","intervention_hard_negative","downstream_validation"],"mapping_boundary":"Disease-treatment and phenotype-treatment context only; never a lexical phenotype vote.","archive_status":"eligible_after_checksum_and_attribution","empirical_status":"new_freeze_required","direct_lexical_vote":false},
    {"source_id":"hpo-associations","name":"HPO disease, gene and phenotype association products","priority":"P1","source_kind":"association_dataset_family","release":"must_match_frozen_hpo_release","authority_url":"https://github.com/obophenotype/human-phenotype-ontology/releases","artifact_url":"release_specific_urls_required","licence":"source_and_annotation_specific_review_required","languages":["en"],"lineage_group":"hpo-annotation-products","evidence_roles":["disease_phenotype_context","gene_phenotype_context","negation_frequency_onset_validation"],"mapping_boundary":"Contextual evaluation data; labels within association products are not independent translations.","archive_status":"metadata_only_until_release_file_rights_and_hashes_pinned","empirical_status":"new_freeze_required","direct_lexical_vote":false},
    {"source_id":"maxo-annotations","name":"MAxO disease-treatment annotations","priority":"P1","source_kind":"association_dataset","release":"must_match_maxo_and_hpo_freeze","authority_url":"https://github.com/monarch-initiative/MAxO","artifact_url":"exact_annotation_artifact_pending","licence":"file_level_review_required","languages":["en"],"lineage_group":"maxo-hpo-treatment","evidence_roles":["treatment_phenotype_consistency","intervention_negative_control"],"mapping_boundary":"Same lineage as MAxO treatment assertions; not a second corroborating vote.","archive_status":"metadata_only","empirical_status":"new_freeze_required","direct_lexical_vote":false},
    {"source_id":"rgd-measurement-stack","name":"CMO, MMO and XCO","priority":"P1","source_kind":"dependent_ontology_family","release":"CMO-2026-07-25_MMO-2026-07-29_XCO-2026-07-29","authority_url":"https://obofoundry.org/ontology/cmo.html","artifact_url":"exact_three_release_artifacts_required","licence":"CC0-1.0","languages":["en"],"lineage_group":"rgd-measurement-stack","evidence_roles":["measurement_composition","method_context","experimental_condition_context","hard_negative"],"mapping_boundary":"Count as one dependent lineage; measurement objects, methods and conditions are not phenotype labels.","archive_status":"eligible_after_per_component_checksum","empirical_status":"new_freeze_required","direct_lexical_vote":false},
    {"source_id":"eco-sepio","name":"Evidence and Conclusion Ontology plus SEPIO","priority":"P1","source_kind":"provenance_ontology_family","release":"ECO-2026-07-10_SEPIO-2023-06-13","authority_url":"https://obofoundry.org/ontology/eco.html","artifact_url":"exact_two_release_artifacts_required","licence":"ECO-CC0_SEPIO-CC-BY-3.0","languages":["en"],"lineage_group":"evidence-provenance-model","evidence_roles":["evidence_type","assertion_provenance","method_agent_lineage"],"mapping_boundary":"Operational provenance vocabulary only; zero lexical or scientific votes.","archive_status":"eligible_after_per_component_checksum_and_attribution","empirical_status":"schema_integration_only","direct_lexical_vote":false},
    {"source_id":"ga4gh-phenopackets","name":"GA4GH Phenopackets","priority":"P1","source_kind":"schema","release":"2.0.0","authority_url":"https://www.ga4gh.org/product/phenopackets/","artifact_url":"https://github.com/ga4gh/phenopacket-schema/tree/v2.0.0","licence":"BSD-3-Clause","languages":[],"language_neutral":true,"lineage_group":"ga4gh-phenopackets-schema","evidence_roles":["evaluation_envelope","round_trip_fidelity","negation_onset_severity_modifier_validation"],"mapping_boundary":"OntologyClass has identifier and label but no language tag; the schema is not multilingual lexical evidence.","archive_status":"public_schema_snapshot_after_commit_hash","empirical_status":"new_freeze_required","direct_lexical_vote":false},
    {"source_id":"phenopacket-store","name":"Phenopacket Store","priority":"P1","source_kind":"benchmark_dataset","release":"exact_commit_required_no_release_tag","authority_url":"https://github.com/monarch-initiative/phenopacket-store","artifact_url":"exact_commit_tree_pending","licence":"repository_BSD-3-Clause_case_level_rights_review_required","languages":["source_language_unverified"],"lineage_group":"phenopacket-case-corpus","evidence_roles":["phenotype_ranking_benchmark","semantic_perturbation","missing_feature_analysis"],"mapping_boundary":"Case HPO labels and source publications are not translation evidence; leakage, de-identification and source rights require per-case audit.","archive_status":"metadata_only_until_case_level_audit","empirical_status":"new_freeze_required","direct_lexical_vote":false},
    {"source_id":"ga4gh-beacon","name":"GA4GH Beacon","priority":"P1","source_kind":"discovery_api_schema","release":"2.2.0","authority_url":"https://www.ga4gh.org/product/beacon-api/","artifact_url":"https://github.com/ga4gh-beacon/beacon-v2/tree/v2.2.0","licence":"CC0-1.0-schema_only","languages":[],"language_neutral":true,"lineage_group":"ga4gh-beacon-schema","evidence_roles":["cohort_discovery","translated_query_retrieval_invariance","selection_bias_audit"],"mapping_boundary":"Schema licence does not authorize endpoint data; endpoint geography never establishes participant language.","archive_status":"public_schema_snapshot_after_checksum","empirical_status":"endpoint_specific_approval_and_new_freeze_required","direct_lexical_vote":false},
    {"source_id":"ga4gh-duo","name":"GA4GH Data Use Ontology","priority":"P1","source_kind":"governance_ontology","release":"2021-02-23","authority_url":"https://www.ga4gh.org/product/data-use-ontology-duo/","artifact_url":"https://github.com/EBISPOT/DUO/tree/v2021-02-23","licence":"file_level_licence_verification_required","languages":["en"],"lineage_group":"ga4gh-duo","evidence_roles":["machine_readable_use_constraint","benchmark_eligibility"],"mapping_boundary":"DUO does not replace copyright, licence, privacy, consent, community-use or redistribution decisions.","archive_status":"metadata_only_until_file_licence_verified","empirical_status":"governance_infrastructure","direct_lexical_vote":false},
    {"source_id":"geno","name":"Genotype Ontology","priority":"P2","source_kind":"ontology","release":"2026-02-02","authority_url":"https://obofoundry.org/ontology/geno.html","artifact_url":"release_specific_artifact_required","licence":"CC-BY-4.0","languages":["en"],"lineage_group":"geno-sepio","evidence_roles":["genotype_phenotype_validation","contradiction_analysis"],"mapping_boundary":"Imported language tags are not maintained GENO translations; no direct lexical use.","archive_status":"eligible_after_checksum_and_import_language_audit","empirical_status":"new_freeze_required","direct_lexical_vote":false},
    {"source_id":"oae","name":"Ontology of Adverse Events","priority":"P2","source_kind":"ontology","release":"1.2.54-2026-04-15","authority_url":"https://obofoundry.org/ontology/oae.html","artifact_url":"release_specific_artifact_required","licence":"CC-BY-4.0","languages":["en"],"lineage_group":"adverse-event-context","evidence_roles":["adverse_event_constitutional_phenotype_disambiguation","drug_conditioned_hard_negative"],"mapping_boundary":"Preserve overlap and dependence with PRO-CTCAE, MedDRA and RxNorm; adverse event is not constitutional phenotype equivalence.","archive_status":"eligible_after_checksum_and_import_review","empirical_status":"new_freeze_required","direct_lexical_vote":false},